{
  "cost": [
    {
      "item": "WOOL",
      "quantity": 4
    }
  ],
  "description": {
    "ar": "ثوب لتدفئة الأتباع.",
    "de": "Warme Roben für warme Anhänger.",
    "en": "Warm robes for warm Followers.",
    "es": "Una prenda abrigada para entrar en calor.",
    "fr": "Une tenue chaude pour réchauffer les adeptes.",
    "fr-CA": "Une tenue chaude pour réchauffer les adeptes.",
    "it": "Vesti calorose per membri calorosi.",
    "ja": "信者を温めるための礼服",
    "ko": "마음 따뜻한 추종자를 위한 따뜻한 로브입니다.",
    "nl": "Een warm gewaad voor een warme volgeling.",
    "pt-BR": "Trajes quentes para seguidores quentes.",
    "ru": "Тёплая одежда для теплокровных последователей.",
    "tr": "Sıcacık Takipçiler için sıcacık bir cübbe.",
    "zh-CN": "温暖的教服，可以温暖教徒。",
    "zh-TW": "溫暖的教服，可以溫暖教徒。"
  },
  "descriptionPlain": {
    "ar": "ثوب لتدفئة الأتباع.",
    "de": "Warme Roben für warme Anhänger.",
    "en": "Warm robes for warm Followers.",
    "es": "Una prenda abrigada para entrar en calor.",
    "fr": "Une tenue chaude pour réchauffer les adeptes.",
    "fr-CA": "Une tenue chaude pour réchauffer les adeptes.",
    "it": "Vesti calorose per membri calorosi.",
    "ja": "信者を温めるための礼服",
    "ko": "마음 따뜻한 추종자를 위한 따뜻한 로브입니다.",
    "nl": "Een warm gewaad voor een warme volgeling.",
    "pt-BR": "Trajes quentes para seguidores quentes.",
    "ru": "Тёплая одежда для теплокровных последователей.",
    "tr": "Sıcacık Takipçiler için sıcacık bir cübbe.",
    "zh-CN": "温暖的教服，可以温暖教徒。",
    "zh-TW": "溫暖的教服，可以溫暖教徒。"
  },
  "effects": [],
  "forSale": false,
  "groups": [],
  "icon": "icons/outfits/Winter_2.png",
  "id": "Winter_2",
  "name": {
    "ar": "كنزة صوفية للمؤيدين",
    "de": "Akolythenpulli",
    "en": "Acolyte Sweater",
    "es": "Suéter de acólito",
    "fr": "Pull d'acolyte",
    "fr-CA": "Chandail d'acolyte",
    "it": "Maglia da seguace",
    "ja": "侍者の冬着",
    "ko": "복사 스웨터",
    "nl": "Acolietentrui",
    "pt-BR": "Agasalho de Acólito",
    "ru": "Свитер верующего",
    "tr": "Destekçi Kazağı",
    "zh-CN": "侍祭毛衣",
    "zh-TW": "侍祭毛衣"
  },
  "namePlain": {
    "ar": "كنزة صوفية للمؤيدين",
    "de": "Akolythenpulli",
    "en": "Acolyte Sweater",
    "es": "Suéter de acólito",
    "fr": "Pull d'acolyte",
    "fr-CA": "Chandail d'acolyte",
    "it": "Maglia da seguace",
    "ja": "侍者の冬着",
    "ko": "복사 스웨터",
    "nl": "Acolietentrui",
    "pt-BR": "Agasalho de Acólito",
    "ru": "Свитер верующего",
    "tr": "Destekçi Kazağı",
    "zh-CN": "侍祭毛衣",
    "zh-TW": "侍祭毛衣"
  },
  "protection": {
    "ar": "يحمي الأتباع من التجمد.",
    "de": "Schützt Anhänger vor dem Frieren.",
    "en": "Protects Follower from freezing.",
    "es": "Resguarda a los adeptos del frío.",
    "fr": "Protège les adeptes du froid.",
    "fr-CA": "Protège les adeptes du froid.",
    "it": "Protegge il membro del Culto dal congelamento.",
    "ja": "信者が凍結するのを防ぐ",
    "ko": "추종자가 빙결되지 않게 보호합니다.",
    "nl": "Beschermt volgeling tegen bevriezing.",
    "pt-BR": "Evita que o seguidor congele.",
    "ru": "Защищает от замерзания.",
    "tr": "Takipçileri donmaktan korur.",
    "zh-CN": "保护教徒免于受冻。",
    "zh-TW": "保護教徒免於受凍。"
  },
  "requirements": {},
  "tab": "majorDlc",
  "thumb": "icons/outfits/64/Winter_2.png"
}
